{
  "required" : true ,
  "$schema" : "http://json-schema.org/draft-03/schema" ,
  "type" : "object" ,
  "properties" : {
    "action" : {
      "type" : "string" ,
      "required" : false
    } ,
    "created_at" : {
      "type" : "string" ,
      "required" : false
    } ,
    "id" : {
      "type" : "number" ,
      "required" : false
    } ,
    "kind" : {
      "type" : "string" ,
      "required" : false
    } ,
    "message" : {
      "type" : "string" ,
      "required" : false
    } ,
    "new_attachment_count" : {
      "type" : "number" ,
      "required" : false
    } ,
    "notification_type" : {
      "type" : "string" ,
      "required" : false
    } ,
    "performer" : {
      "type" : "object" ,
      "required" : false ,
      "properties" : {
        "kind" : {
          "type" : "string" ,
          "required" : false
        } ,
        "id" : {
          "type" : "number" ,
          "required" : false
        } ,
        "name" : {
          "type" : "string" ,
          "required" : false
        }
      }
    } ,
    "project" : {
      "type" : "object" ,
      "required" : false ,
      "properties" : {
        "kind" : {
          "type" : "string" ,
          "required" : false
        } ,
        "id" : {
          "type" : "number" ,
          "required" : false
        } ,
        "name" : {
          "type" : "string" ,
          "required" : false
        }
      }
    } ,
    "read_at" : {
      "type" : "string" ,
      "required" : false
    } ,
    "story" : {
      "type" : "object" ,
      "required" : false ,
      "properties" : {
        "kind" : {
          "type" : "string" ,
          "required" : false
        } ,
        "id" : {
          "type" : "number" ,
          "required" : false
        } ,
        "name" : {
          "type" : "string" ,
          "required" : false
        }
      }
    } ,
    "updated_at" : {
      "type" : "string" ,
      "required" : false
    }
  }
}