{
  "action" : "ownership" ,
  "created_at" : "2014-07-22T12:00:00Z" ,
  "id" : 21 ,
  "kind" : "notification" ,
  "message" : "Wilhuff Tarkin has made you an owner of this story:" ,
  "new_attachment_count" : 0 ,
  "notification_type" : "story" ,
  "performer" : {
    "kind" : "person" ,
    "id" : 102 ,
    "name" : "Wilhuff Tarkin"
  } ,
  "project" : {
    "kind" : "project" ,
    "id" : 99 ,
    "name" : "Death Star"
  } ,
  "read_at" : "2014-07-22T12:00:05Z" ,
  "story" : {
    "kind" : "story" ,
    "id" : 558 ,
    "name" : "All exhaust ports should be shielded"
  } ,
  "updated_at" : "2014-07-22T12:00:05Z"
}